{
  "$schema": "https://json-schema.org/draft/2020-12/schema",
  "$id": "https://tin-canmcp.dev/schema/tools.schema.json",
  "title": "tools.json",
  "type": "array",
  "items": {
    "type": "object",
    "required": [
      "name",
      "description",
      "group",
      "tier",
      "status",
      "canonical_tool",
      "overlap_family",
      "source_path",
      "catalog_path",
      "executable",
      "priority",
      "default_exposed"
    ],
    "properties": {
      "name": { "type": "string", "minLength": 1 },
      "description": { "type": "string", "minLength": 1 },
      "group": { "type": "string", "minLength": 1 },
      "tier": { "type": "string", "minLength": 1 },
      "status": { "type": "string", "minLength": 1 },
      "canonical_tool": { "type": "string", "minLength": 1 },
      "overlap_family": { "type": ["string", "null"] },
      "source_path": { "type": "string", "minLength": 1 },
      "catalog_path": { "type": "string", "minLength": 1 },
      "executable": { "type": "string", "minLength": 1 },
      "priority": { "type": "integer" },
      "default_exposed": { "type": "boolean" },
      "source_variants": { "type": "array", "items": { "type": "string" } },
      "tags": { "type": "array", "items": { "type": "string" } },
      "input_schema": { "type": "object" }
    },
    "additionalProperties": true
  }
}
